Session-old	Date	Start Time	End Time	PID-old	PID	Title	Author	Category	Track	Session	Session ID_underline	Poster(pref)	Hybrid Unit No	Assigned Board	Location	Presentation Order
Session 4	2023-12-08	16:00	17:30	1629	1629	Question Answering as Programming for Solving Time-Sensitive Questions	"Xinyu Zhu,Cheng Yang,Bei Chen,Siheng Li,Jian-Guang Lou,Yujiu Yang"	Main-Poster	Question Answering	Poster_Demo_Industry_Findings In-person 3	16519	In person			East Foyer	
Session 4	2023-12-08	16:00	17:30	1716	1716	EDeR: Towards Understanding Dependency Relations Between Events	"Ruiqi Li,Patrik Haslum,Leyang Cui"	Main-Poster	Resources and Evaluation	Poster_Demo_Industry_Findings In-person 3	16519	In person			East Foyer	
Session 4	2023-12-08	16:00	17:30	1763	1763	Optimized Tokenization for Transcribed Error Correction	"Tomer Wullach,Shlomo Chazan"	Main-Poster	Speech and Multimodality	Poster_Demo_Industry_Findings In-person 3	16519	In person			East Foyer	
Session 4	2023-12-08	16:00	17:30	1810	1810	Interview Evaluation: A Novel Approach for Automatic Evaluation of Conversational Question Answering Models	"Xibo Li,Bowei Zou,Yifan Fan,Yanling Li,AiTi Aw,Yu Hong"	Main-Poster	Question Answering	Poster_Demo_Industry_Findings In-person 3	16519	In person			East Foyer	
Session 4	2023-12-08	16:00	17:30	1849	1849	Exploring the Boundaries of GPT-4 in Radiology	"Qianchu Liu,Stephanie Hyland,Shruthi Bannur,Kenza Bouzid,Daniel C. Castro,Maria Teodora Wetscherek,Robert Tinn,Harshita Sharma,Fernando Pérez-García,Anton Schwaighofer,Pranav Rajpurkar,Sameer Tajdin Khanna,Hoifung Poon,Naoto Usuyama,Anja Thieme,Aditya V. Nori,Matthew P. Lungren,Ozan Oktay,Javier Alvarez-Valle"	Main-Poster	Resources and Evaluation	Poster_Demo_Industry_Findings In-person 3	16519	In person			East Foyer	
Session 4	2023-12-08	16:00	17:30	1922	1922	Retrofitting Light-weight Language Models for Emotions using Supervised Contrastive Learning	"Sapan Shah,Sreedhar Reddy,Pushpak Bhattacharyya"	Main-Poster	"Semantics: Lexical, Sentence level, Document Level, Textual Inference, etc."	Poster_Demo_Industry_Findings In-person 3	16519	In person			East Foyer	
Session 4	2023-12-08	16:00	17:30	1950	1950	Speech-enriched Memory for Inference-time Adaptation of ASR Models to Word Dictionaries	"Ashish Mittal,Sunita Sarawagi,Preethi Jyothi,George Saon,Gakuto Kurata"	Main-Poster	Speech and Multimodality	Poster_Demo_Industry_Findings In-person 3	16519	In person			East Foyer	
Session 4	2023-12-08	16:00	17:30	1954	1954	DUMB: A Dutch Model Benchmark	"Wietse de Vries,Martijn Wieling,Malvina Nissim"	Main-Poster	Resources and Evaluation	Poster_Demo_Industry_Findings In-person 3	16519	In person			East Foyer	
Session 4	2023-12-08	16:00	17:30	1970	1970	MILDSum: A Novel Benchmark Dataset for Multilingual Summarization of Indian Legal Case Judgments	"Debtanu Datta,Shubham Soni,Rajdeep Mukherjee,Saptarshi Ghosh"	Main-Poster	Resources and Evaluation	Poster_Demo_Industry_Findings In-person 3	16519	In person			East Foyer	
Session 4	2023-12-08	16:00	17:30	1974	1974	When Do Decompositions Help for Machine Reading?	"Kangda Wei,Dawn Lawrie,Benjamin Van Durme,Yunmo Chen,Orion Weller"	Main-Poster	Question Answering	Poster_Demo_Industry_Findings In-person 3	16519	In person			East Foyer	
Session 4	2023-12-08	16:00	17:30	1995	1995	Let GPT be a Math Tutor: Teaching Math Word Problem Solvers with Customized Exercise Generation	"Zhenwen Liang,Wenhao Yu,Tanmay Rajpurohit,Peter Clark,Xiangliang Zhang,Ashwin Kalyan"	Main-Poster	Question Answering	Poster_Demo_Industry_Findings In-person 3	16519	In person			East Foyer	
Session 4	2023-12-08	16:00	17:30	2092	2092	Counter Turing Test (CT2): AI-Generated Text Detection is Not as Easy as You May Think - Introducing AI Detectability Index (ADI)	"Megha Chakraborty,S.M Towhidul Islam Tonmoy,S M Mehedi Zaman,Shreya Gautam,Tanay Kumar,Krish Sharma,Niyar R Barman,Chandan Gupta,Vinija Jain,Aman Chadha,Amit P. Sheth,Amitava Das"	Main-Poster	Resources and Evaluation	Poster_Demo_Industry_Findings In-person 3	16519	In person			East Foyer	
Session 4	2023-12-08	16:00	17:30	2115	2115	FACTIFY3M: A benchmark for multimodal fact verification with explainability through 5W Question-Answering	"Megha Chakraborty,Khushbu Pahwa,Anku Rani,Shreyas Chatterjee,Dwip Dalal,Harshit Dave,Ritvik G,Preethi Gurumurthy,Adarsh Ashok Mahor,Samahriti Mukherjee,Aditya Pakala,Ishan Paul,Janvita Reddy,Arghya Sarkar,Kinjal Sensharma,Aman Chadha,Amit P. Sheth,Amitava Das"	Main-Poster	Resources and Evaluation	Poster_Demo_Industry_Findings In-person 3	16519	In person			East Foyer	
Session 4	2023-12-08	16:00	17:30	2117	2117	LM vs LM: Detecting Factual Errors via Cross Examination	"Roi Cohen,May Hamri,Mor Geva,Amir Globerson"	Main-Poster	Question Answering	Poster_Demo_Industry_Findings In-person 3	16519	In person			East Foyer	
Session 4	2023-12-08	16:00	17:30	2118	2118	On the Challenges of Using Black-Box APIs for Toxicity Evaluation in Research	"Luiza Amador Pozzobon,Beyza Ermis,Patrick Lewis,Sara Hooker"	Main-Poster	Resources and Evaluation	Poster_Demo_Industry_Findings In-person 3	16519	In person			East Foyer	
Session 4	2023-12-08	16:00	17:30	2214	2214	StrAE: Autoencoding for Pre-Trained Embeddings using Explicit Structure	"Mattia Opper,Victor Prokhorov,Siddharth N"	Main-Poster	"Semantics: Lexical, Sentence level, Document Level, Textual Inference, etc."	Poster_Demo_Industry_Findings In-person 3	16519	In person			East Foyer	
Session 4	2023-12-08	16:00	17:30	2366	2366	TOD-Flow: Modeling the Structure of Task-Oriented Dialogues	"Sungryull Sohn,Yiwei Lyu,Anthony Zhe Liu,Lajanugen Logeswaran,Dong-Ki Kim,Dongsub Shim,Honglak Lee"	Main-Poster	Dialogue and Interactive Systems	Poster_Demo_Industry_Findings In-person 3	16519	In person			East Foyer	
Session 4	2023-12-08	16:00	17:30	2428	2428	Accented Speech Recognition With Accent-specific Codebooks	"Darshan Deepak Prabhu,Preethi Jyothi,Sriram Ganapathy,Vinit Unni"	Main-Poster	Speech and Multimodality	Poster_Demo_Industry_Findings In-person 3	16519	In person			East Foyer	
Session 4	2023-12-08	16:00	17:30	2436	2436	Ideology Takes Multiple Looks: A High-Quality Dataset for Multifaceted Ideology Detection	"Songtao Liu,Ziling Luo,Minghua Xu,LiXiao Wei,Ziyao Wei,Han Yu,Wei Xiang,Bang Wang"	Main-Poster	Resources and Evaluation	Poster_Demo_Industry_Findings In-person 3	16519	In person			East Foyer	
Session 4	2023-12-08	16:00	17:30	2443	2443	A Challenging Multimodal Video Summary: Simultaneously Extracting and Generating Keyframe-Caption Pairs from Video	"Keito Kudo,Haruki Nagasawa,Jun Suzuki,Nobuyuki Shimizu"	Main-Poster	Speech and Multimodality	Poster_Demo_Industry_Findings In-person 3	16519	In person			East Foyer	
Session 4	2023-12-08	16:00	17:30	2460	2460	Semantic Space Grounded Weighted Decoding for Multi-Attribute Controllable Dialogue Generation	"Zhiling Zhang,Mengyue Wu,Kenny Q. Zhu"	Main-Poster	Dialogue and Interactive Systems	Poster_Demo_Industry_Findings In-person 3	16519	In person			East Foyer	
Session 4	2023-12-08	16:00	17:30	2472	2472	CESAR: Automatic Induction of Compositional Instructions for Multi-turn Dialogs	"Taha Aksu,Devamanyu Hazarika,Shikib Mehri,Seokhwan Kim,Dilek Hakkani-Tur,Yang Liu,Mahdi Namazifar"	Main-Poster	Dialogue and Interactive Systems	Poster_Demo_Industry_Findings In-person 3	16519	In person			East Foyer	
Session 4	2023-12-08	16:00	17:30	2522	2522	Training Simultaneous Speech Translation with Robust and Random Wait-k-Tokens Strategy	"Linlin Zhang,Kai Fan,Jiajun Bu,Zhongqiang Huang"	Main-Poster	Speech and Multimodality	Poster_Demo_Industry_Findings In-person 3	16519	In person			East Foyer	
Session 4	2023-12-08	16:00	17:30	2531	2531	Evaluating Evaluation Metrics: A Framework for Analyzing NLG Evaluation Metrics using Measurement Theory	"Ziang Xiao,Susu Zhang,Vivian Lai,Q.Vera Liao"	Main-Poster	Resources and Evaluation	Poster_Demo_Industry_Findings In-person 3	16519	In person			East Foyer	
Session 4	2023-12-08	16:00	17:30	2554	2554	CLEME: Debiasing Multi-reference Evaluation for Grammatical Error Correction	"Jingheng Ye,Yinghui Li,Qingyu Zhou,Yangning Li,Shirong Ma,Hai-Tao Zheng,Ying Shen"	Main-Poster	Resources and Evaluation	Poster_Demo_Industry_Findings In-person 3	16519	In person			East Foyer	
Session 4	2023-12-08	16:00	17:30	2578	2578	Rethinking the Evaluation for Conversational Recommendation in the Era of Large Language Models	"Xiaolei Wang,Xinyu Tang,Xin Zhao,Jingyuan Wang,Ji-Rong Wen"	Main-Poster	Dialogue and Interactive Systems	Poster_Demo_Industry_Findings In-person 3	16519	In person			East Foyer	
Session 4	2023-12-08	16:00	17:30	2590	2590	Query Rewriting in Retrieval-Augmented Large Language Models	"Xinbei Ma,Yeyun Gong,Pengcheng He,hai zhao,Nan Duan"	Main-Poster	Question Answering	Poster_Demo_Industry_Findings In-person 3	16519	In person			East Foyer	
Session 4	2023-12-08	16:00	17:30	2652	2652	A Framework for Vision-Language Warm-up Tasks in Multimodal Dialogue Models	"Jaewook Lee,Seongsik Park,Seong-Heum Park,Hongjin KIM,Harksoo Kim"	Main-Poster	Dialogue and Interactive Systems	Poster_Demo_Industry_Findings In-person 3	16519	In person			East Foyer	
Session 4	2023-12-08	16:00	17:30	2668	2668	Causal Document-Grounded Dialogue Pre-training	"Yingxiu Zhao,Bowen Yu,Bowen Li,Haiyang Yu,Jinyang Li,Chao Wang,Fei Huang,Yongbin Li,Nevin L. Zhang"	Main-Poster	Dialogue and Interactive Systems	Poster_Demo_Industry_Findings In-person 3	16519	In person			East Foyer	
Session 4	2023-12-08	16:00	17:30	2671	2671	API-Assisted Code Generation for Question Answering on Varied Table Structures	"Yihan Cao,Shuyi Chen,Ryan Liu,Zhiruo Wang,Daniel Fried"	Main-Poster	Question Answering	Poster_Demo_Industry_Findings In-person 3	16519	In person			East Foyer	
Session 4	2023-12-08	16:00	17:30	2768	2768	M$^3$Seg: A Maximum-Minimum Mutual Information Paradigm for Unsupervised Topic Segmentation in ASR Transcripts	"Ke Wang,Xiutian Zhao,Yanghui Li,Wei Peng"	Main-Poster	"Semantics: Lexical, Sentence level, Document Level, Textual Inference, etc."	Poster_Demo_Industry_Findings In-person 3	16519	In person			East Foyer	
Session 4	2023-12-08	16:00	17:30	2781	2781	RoBoCoP: A Comprehensive ROmance BOrrowing COgnate Package and Benchmark for Multilingual Cognate Identification	"Liviu P Dinu,Ana Sabina Uban,Alina Maria Cristea,Anca Daniela Dinu,Ioan-Bogdan Iordache,Simona Georgescu,Laurentiu Zoicas"	Main-Poster	Resources and Evaluation	Poster_Demo_Industry_Findings In-person 3	16519	In person			East Foyer	
Session 4	2023-12-08	16:00	17:30	2803	2803	CS2W: A Chinese Spoken-to-Written Style Conversion Dataset with Multiple Conversion Types	"Zishan Guo,Linhao Yu,Minghui Xu,Renren Jin,Deyi Xiong"	Main-Poster	Resources and Evaluation	Poster_Demo_Industry_Findings In-person 3	16519	In person			East Foyer	
Session 4	2023-12-08	16:00	17:30	2847	2847	StoryAnalogy: Deriving Story-level Analogies from Large Language Models to Unlock Analogical Understanding	"Cheng Jiayang,Lin Qiu,Tsz Ho CHAN,Tianqing Fang,Weiqi Wang,Chunkit Chan,Dongyu Ru,Qipeng Guo,Hongming Zhang,Yangqiu Song,Yue Zhang,Zheng Zhang"	Main-Poster	Resources and Evaluation	Poster_Demo_Industry_Findings In-person 3	16519	In person			East Foyer	
Session 4	2023-12-08	16:00	17:30	2901	2901	The ACL OCL Corpus: Advancing Open Science in Computational Linguistics	"Shaurya Rohatgi,Yanxia Qin,Benjamin Aw,Niranjana Anand Unnithan,Min-Yen Kan"	Main-Poster	Resources and Evaluation	Poster_Demo_Industry_Findings In-person 3	16519	In person			East Foyer	
Session 4	2023-12-08	16:00	17:30	2924	2924	BLESS: Benchmarking Large Language Models on Sentence Simplification	"Tannon Kew,Alison Chi,Laura Vásquez-Rodríguez,Sweta Agrawal,Dennis Aumiller,Fernando Alva-Manchego,Matthew Shardlow"	Main-Poster	Resources and Evaluation	Poster_Demo_Industry_Findings In-person 3	16519	In person			East Foyer	
Session 4	2023-12-08	16:00	17:30	2931	2931	mRedditSum: A Multimodal Abstractive Summarization Dataset of Reddit Threads with Images	"Keighley Overbay,Jaewoo Ahn,Fatemeh Pesaran zadeh,Joonsuk Park,Gunhee Kim"	Main-Poster	Resources and Evaluation	Poster_Demo_Industry_Findings In-person 3	16519	In person			East Foyer	
Session 4	2023-12-08	16:00	17:30	2952	2952	DiffS2UT: A Semantic Preserving Diffusion Model for Textless Direct Speech-to-Speech Translation	"Yongxin Zhu,Zhujin Gao,Xinyuan Zhou,Ye Zhongyi,Linli Xu"	Main-Poster	Speech and Multimodality	Poster_Demo_Industry_Findings In-person 3	16519	In person			East Foyer	
Session 4	2023-12-08	16:00	17:30	2963	2963	HutCRS: Hierarchical User-Interest Tracking for Conversational Recommender System	"Mingjie Qian,Yongsen Zheng,Jinghui Qin,Liang Lin"	Main-Poster	Dialogue and Interactive Systems	Poster_Demo_Industry_Findings In-person 3	16519	In person			East Foyer	
Session 4	2023-12-08	16:00	17:30	2976	2976	Conversational Semantic Parsing using Dynamic Context Graphs	"Parag Jain,Mirella Lapata"	Main-Poster	Question Answering	Poster_Demo_Industry_Findings In-person 3	16519	In person			East Foyer	
Session 4	2023-12-08	16:00	17:30	2984	2984	Back Transcription as a Method for Evaluating Robustness of Natural Language Understanding Models to Speech Recognition Errors	"Marek Kubis,Paweł Marek Skórzewski,Marcin Sowanski,TOMASZ ZIĘTKIEWICZ"	Main-Poster	Dialogue and Interactive Systems	Poster_Demo_Industry_Findings In-person 3	16519	In person			East Foyer	
Session 4	2023-12-08	16:00	17:30	3020	3020	Large Language Models are Complex Table Parsers	"Bowen Zhao,Changkai Ji,Yuejie Zhang,Wen He,Yingwen Wang,Qing Wang,Rui Feng,Xiaobo Zhang"	Main-Poster	Question Answering	Poster_Demo_Industry_Findings In-person 3	16519	In person			East Foyer	
Session 4	2023-12-08	16:00	17:30	3032	3032	Dialogizer: Context-aware Conversational-QA Dataset Generation from Textual Sources	"Yerin Hwang,Yongil Kim,Hyunkyung Bae,Hwanhee Lee,Jeesoo Bang,Kyomin Jung"	Main-Poster	Dialogue and Interactive Systems	Poster_Demo_Industry_Findings In-person 3	16519	In person			East Foyer	
Session 4	2023-12-08	16:00	17:30	3047	3047	Graph vs. Sequence: An Empirical Study on Knowledge Forms for Knowledge-Grounded Dialogue	"Yizhe Yang,Heyan Huang,Yuhang Liu,Yang Gao"	Main-Poster	Dialogue and Interactive Systems	Poster_Demo_Industry_Findings In-person 3	16519	In person			East Foyer	
Session 4	2023-12-08	16:00	17:30	3090	3090	Beyond Factuality: A Comprehensive Evaluation of Large Language Models as Knowledge Generators	"Liang CHEN,Yang Deng,Yatao Bian,Zeyu Qin,Bingzhe Wu,Tat-Seng Chua,Kam-Fai Wong"	Main-Poster	Resources and Evaluation	Poster_Demo_Industry_Findings In-person 3	16519	In person			East Foyer	
Session 4	2023-12-08	16:00	17:30	3100	3100	A Fair and In-Depth Evaluation of Existing End-to-End Entity Linking Systems	"Hannah Bast,Matthias Hertel,Natalie Prange"	Main-Poster	Resources and Evaluation	Poster_Demo_Industry_Findings In-person 3	16519	In person			East Foyer	
Session 4	2023-12-08	16:00	17:30	3121	3121	Tree of Clarifications: Answering Ambiguous Questions with Retrieval-Augmented Large Language Models	"Gangwoo Kim,Sungdong Kim,Byeongguk Jeon,Joonsuk Park,Jaewoo Kang"	Main-Poster	Question Answering	Poster_Demo_Industry_Findings In-person 3	16519	In person			East Foyer	
Session 4	2023-12-08	16:00	17:30	3198	3198	MarkQA: A large scale KBQA dataset with numerical reasoning	"Xiang Huang,Sitao Cheng,Yuheng Bao,Shanshan Huang,Yuzhong Qu"	Main-Poster	Question Answering	Poster_Demo_Industry_Findings In-person 3	16519	In person			East Foyer	
Session 4	2023-12-08	16:00	17:30	3233	3233	Find-2-Find: Multitask Learning for Anaphora Resolution and Object Localization	"Cennet Oguz,Pascal Denis,Emmanuel Vincent,Simon Ostermann,Josef van Genabith"	Main-Poster	"Semantics: Lexical, Sentence level, Document Level, Textual Inference, etc."	Poster_Demo_Industry_Findings In-person 3	16519	In person			East Foyer	
Session 4	2023-12-08	16:00	17:30	3236	3236	Best of Both Worlds: Towards Improving Temporal Knowledge Base Question Answering via Targeted Fact Extraction	"Nithish Kannen,Udit Sharma,Sumit Neelam,Dinesh Khandelwal,Shajith Ikbal,Hima Karanam,L Venkata Subramaniam"	Main-Poster	Question Answering	Poster_Demo_Industry_Findings In-person 3	16519	In person			East Foyer	
Session 4	2023-12-08	16:00	17:30	3340	3340	From Parse-Execute to Parse-Execute-Refine: Improving Semantic Parser for Complex Question Answering over Knowledge Base	"Wangzhen Guo,Linyin Luo,Hanjiang Lai,Jian Yin"	Main-Poster	Question Answering	Poster_Demo_Industry_Findings In-person 3	16519	In person			East Foyer	
Session 4	2023-12-08	16:00	17:30	3426	3426	Diversify Question Generation with Retrieval-Augmented Style Transfer	"Qi Gou,Zehua Xia,Bowen Yu,Haiyang Yu,Fei Huang,Yongbin Li,Nguyen Cam-Tu"	Main-Poster	Question Answering	Poster_Demo_Industry_Findings In-person 3	16519	In person			East Foyer	
Session 4	2023-12-08	16:00	17:30	3464	3464	PRCA: Fitting Black-Box Large Language Models for Retrieval Question Answering via Pluggable Reward-Driven Contextual Adapter	"Haoyan Yang,Zhitao Li,Yong Zhang,Jianzong Wang,Ning Cheng,Ming Li,Jing Xiao"	Main-Poster	Question Answering	Poster_Demo_Industry_Findings In-person 3	16519	In person			East Foyer	
Session 4	2023-12-08	16:00	17:30	3512	3512	"Re$^3$Dial: Retrieve, Reorganize and Rescale Conversations for Long-Turn Open-Domain Dialogue Pre-training"	"Jiaxin Wen,Hao Zhou,Jian Guan,Jie Zhou,Minlie Huang"	Main-Poster	Dialogue and Interactive Systems	Poster_Demo_Industry_Findings In-person 3	16519	In person			East Foyer	
Session 4	2023-12-08	16:00	17:30	3578	3578	SEER : A Knapsack approach to Exemplar Selection for In-Context HybridQA	"Jonathan Tonglet,Manon Reusens,Philipp Borchert,Bart Baesens"	Main-Poster	Question Answering	Poster_Demo_Industry_Findings In-person 3	16519	In person			East Foyer	
Session 4	2023-12-08	16:00	17:30	3605	3605	Non-Autoregressive Math Word Problem Solver with Unified Tree Structure	"Yi Bin,Mengqun Han,WENHAO SHI,Lei Wang,Yang Yang,See-Kiong Ng,Heng Tao Shen"	Main-Poster	Question Answering	Poster_Demo_Industry_Findings In-person 3	16519	In person			East Foyer	
Session 4	2023-12-08	16:00	17:30	3621	3621	TRAVEL: Tag-Aware Conversational FAQ Retrieval via Reinforcement Learning	"Yue Chen,Dingnan Jin,Chen Huang,Jia Liu,Wenqiang Lei"	Main-Poster	Dialogue and Interactive Systems	Poster_Demo_Industry_Findings In-person 3	16519	In person			East Foyer	
Session 4	2023-12-08	16:00	17:30	3645	3645	A Diffusion Weighted Graph Framework for New Intent Discovery	"Wenkai Shi,Wenbin An,Feng Tian,Qinghua Zheng,QianYing Wang,Ping Chen"	Main-Poster	Dialogue and Interactive Systems	Poster_Demo_Industry_Findings In-person 3	16519	In person			East Foyer	
Session 4	2023-12-08	16:00	17:30	3653	3653	Paraphrase Types for Generation and Detection	"Jan Philip Wahle,Bela Gipp,Terry Ruas"	Main-Poster	"Semantics: Lexical, Sentence level, Document Level, Textual Inference, etc."	Poster_Demo_Industry_Findings In-person 3	16519	In person			East Foyer	
Session 4	2023-12-08	16:00	17:30	3787	3787	PRESTO: A Multilingual Dataset for Parsing Realistic Task-Oriented Dialogs	"Rahul Goel,Waleed Ammar,Aditya Gupta,Siddharth Vashishtha,Motoki Sano,Faiz Surani,Max Chang,HyunJeong Choe,David Greene,Chuan He,Rattima Nitisaroj,Anna Trukhina,Shachi Paul,Pararth Shah,Rushin Shah,Zhou Yu"	Main-Poster	Dialogue and Interactive Systems	Poster_Demo_Industry_Findings In-person 3	16519	In person			East Foyer	
Session 4	2023-12-08	16:00	17:30	3895	3895	A Simple Baseline for Knowledge-Based Visual Question Answering	"ALEXANDROS XENOS,Themos Stafylakis,Ioannis Patras,Georgios Tzimiropoulos"	Main-Poster	Question Answering	Poster_Demo_Industry_Findings In-person 3	16519	In person			East Foyer	
Session 4	2023-12-08	16:00	17:30	3969	3969	Weakly Supervised Semantic Parsing with Execution-based Spurious Program Filtering	"Kang-il Lee,Segwang Kim,Kyomin Jung"	Main-Poster	"Semantics: Lexical, Sentence level, Document Level, Textual Inference, etc."	Poster_Demo_Industry_Findings In-person 3	16519	In person			East Foyer	
Session 4	2023-12-08	16:00	17:30	3994	3994	Mitigating Temporal Misalignment by Discarding Outdated Facts	"Michael JQ Zhang,Eunsol Choi"	Main-Poster	Question Answering	Poster_Demo_Industry_Findings In-person 3	16519	In person			East Foyer	
Session 4	2023-12-08	16:00	17:30	4005	4005	Have LLMs Advanced Enough? A Challenging Problem Solving Benchmark For Large Language Models	"Daman Arora,Himanshu Gaurav Singh,Mausam ."	Main-Poster	Question Answering	Poster_Demo_Industry_Findings In-person 3	16519	In person			East Foyer	
Session 4	2023-12-08	16:00	17:30	4206	4206	Continual Dialogue State Tracking via Example-Guided Question Answering	"Hyundong Justin Cho,Andrea Madotto,Zhaojiang Lin,Khyathi Chandu,Satwik Kottur,Jing Xu,Jonathan May,Chinnadhurai Sankar"	Main-Poster	Dialogue and Interactive Systems	Poster_Demo_Industry_Findings In-person 3	16519	In person			East Foyer	
Session 4	2023-12-08	16:00	17:30	4360	4360	C-STS: Conditional Semantic Textual Similarity	"Ameet Deshpande,Carlos E Jimenez,Howard Chen,Vishvak Murahari,Victoria Graf,Tanmay Rajpurohit,Ashwin Kalyan,Danqi Chen,Karthik R Narasimhan"	Main-Poster	"Semantics: Lexical, Sentence level, Document Level, Textual Inference, etc."	Poster_Demo_Industry_Findings In-person 3	16519	In person			East Foyer	
Session 4	2023-12-08	16:00	17:30	4365	4365	Selectively Answering Ambiguous Questions	"Jeremy R. Cole,Michael JQ Zhang,Daniel Gillick,Julian Martin Eisenschlos,Bhuwan Dhingra,Jacob Eisenstein"	Main-Poster	Question Answering	Poster_Demo_Industry_Findings In-person 3	16519	In person			East Foyer	
Session 4	2023-12-08	16:00	17:30	4469	4469	Active Retrieval Augmented Generation	"Zhengbao Jiang,Frank F. Xu,Luyu Gao,Zhiqing Sun,Qian Liu,Jane Dwivedi-Yu,Yiming Yang,Jamie Callan,Graham Neubig"	Main-Poster	Question Answering	Poster_Demo_Industry_Findings In-person 3	16519	In person			East Foyer	
Session 4	2023-12-08	16:00	17:30	4485	4485	BERTie Bott's Every Flavor Labels: A Tasty Introduction to Semantic Role Labeling for Galician	"Micaella Bruton,Meriem Beloucif"	Main-Poster	"Semantics: Lexical, Sentence level, Document Level, Textual Inference, etc."	Poster_Demo_Industry_Findings In-person 3	16519	In person			East Foyer	
Session 4	2023-12-08	16:00	17:30	4618	4618	"Fine-tuned LLMs Know More, Hallucinate Less with Few-Shot Sequence-to-Sequence Semantic Parsing over Wikidata"	"Silei Xu,Shicheng Liu,Theo Culhane,Elizaveta Pertseva,Meng-Hsi Wu,Sina Semnani,Monica Lam"	Main-Poster	Question Answering	Poster_Demo_Industry_Findings In-person 3	16519	In person			East Foyer	
Session 4	2023-12-08	16:00	17:30	4653	4653	Bridging Continuous and Discrete Spaces: Interpretable Sentence Representation Learning via Compositional Operations	"James Y. Huang,Wenlin Yao,Kaiqiang Song,Hongming Zhang,Muhao Chen,Dong Yu"	Main-Poster	"Semantics: Lexical, Sentence level, Document Level, Textual Inference, etc."	Poster_Demo_Industry_Findings In-person 3	16519	In person			East Foyer	
Session 4	2023-12-08	16:00	17:30	4741	4741	Exploring Chain of Thought Style Prompting for Text-to-SQL	"Chang-Yu Tai,Ziru Chen,TIANSHU ZHANG,Xiang Deng,Huan Sun"	Main-Poster	"Semantics: Lexical, Sentence level, Document Level, Textual Inference, etc."	Poster_Demo_Industry_Findings In-person 3	16519	In person			East Foyer	
Session 4	2023-12-08	16:00	17:30	4759	4759	Towards a Unified Conversational Recommendation System: Multi-task Learning via Contextualized Knowledge Distillation	"Yeongseo Jung,Eunseo Jung,Lei Chen"	Main-Poster	Dialogue and Interactive Systems	Poster_Demo_Industry_Findings In-person 3	16519	In person			East Foyer	
Session 4	2023-12-08	16:00	17:30	4790	4790	"DeSIQ: Towards an Unbiased, Challenging Benchmark for Social Intelligence Understanding"	"Xiao-Yu Guo,Yuan-Fang Li,Reza Haf"	Main-Poster	Question Answering	Poster_Demo_Industry_Findings In-person 3	16519	In person			East Foyer	
Session 4	2023-12-08	16:00	17:30	4801	4801	We're Afraid Language Models Aren't Modeling Ambiguity	"Alisa Liu,Zhaofeng Wu,Julian Michael,Alane Suhr,Peter West,Alexander Koller,Swabha Swayamdipta,Noah A. Smith,Yejin Choi"	Main-Poster	"Semantics: Lexical, Sentence level, Document Level, Textual Inference, etc."	Poster_Demo_Industry_Findings In-person 3	16519	In person			East Foyer	
Session 4	2023-12-08	16:00	17:30	4865	4865	Length is a Curse and a Blessing for Document-level Semantics	"Chenghao Xiao,Yizhi LI,G Thomas Hudson,Chenghua Lin,Noura Al Moubayed"	Main-Poster	"Semantics: Lexical, Sentence level, Document Level, Textual Inference, etc."	Poster_Demo_Industry_Findings In-person 3	16519	In person			East Foyer	
Session 4	2023-12-08	16:00	17:30	4926	4926	Well Begun is Half Done: Generator-agnostic Knowledge Pre-Selection for Knowledge-Grounded Dialogue	"Lang Qin,YAO ZHANG,Hongru Liang,Jun Wang,Zhenglu Yang"	Main-Poster	Dialogue and Interactive Systems	Poster_Demo_Industry_Findings In-person 3	16519	In person			East Foyer	
Session 4	2023-12-08	16:00	17:30	4994	4994	AMR Parsing with Causal Hierarchical Attention and Pointers	"Chao Lou,Kewei Tu"	Main-Poster	"Semantics: Lexical, Sentence level, Document Level, Textual Inference, etc."	Poster_Demo_Industry_Findings In-person 3	16519	In person			East Foyer	
Session 4	2023-12-08	16:00	17:30	5134	5134	Chain-of-Questions Training with Latent Answers for Robust Multistep Question Answering	"Wang Zhu,Jesse Thomason,Robin Jia"	Main-Poster	Question Answering	Poster_Demo_Industry_Findings In-person 3	16519	In person			East Foyer	
Session 4	2023-12-08	16:00	17:30	5231	5231	Scalable-DSC: A Structural Template Prompt Approach to Scalable Dialogue State Correction	"Haoxiang Su,Hongyan Xie,Hao Huang,Shuangyong Song,Ruiyu Fang,Xiaomeng Huang,Sijie Feng"	Main-Poster	Dialogue and Interactive Systems	Poster_Demo_Industry_Findings In-person 3	16519	In person			East Foyer	
Session 4	2023-12-08	16:00	17:30	5367	5367	SuperDialseg: A Large-scale Dataset for Supervised Dialogue Segmentation	"Junfeng Jiang,ChengZhang Dong,Sadao Kurohashi,Akiko Aizawa"	Main-Poster	Dialogue and Interactive Systems	Poster_Demo_Industry_Findings In-person 3	16519	In person			East Foyer	
